{
  "$schema": "http://json-schema.org/draft-07/schema#",
  "title": "Solution Architect Output",
  "type": "object",
  "required": ["services", "data_models", "infrastructure_spec"],
  "properties": {
    "architecture_diagram_ref": {
      "type": "string",
      "description": "Artifact ID reference for architecture diagram"
    },
    "services": {
      "type": "array",
      "description": "Microservices and their responsibilities",
      "items": {
        "type": "object",
        "required": ["name", "responsibility", "tech"],
        "properties": {
          "name": { "type": "string" },
          "responsibility": { "type": "string" },
          "tech": { "type": "string" },
          "api_endpoints": {
            "type": "array",
            "items": { "type": "string" }
          },
          "dependencies": {
            "type": "array",
            "items": { "type": "string" }
          }
        }
      }
    },
    "data_models": {
      "type": "array",
      "description": "Entity definitions and relationships",
      "items": {
        "type": "object",
        "required": ["entity", "fields"],
        "properties": {
          "entity": { "type": "string" },
          "fields": {
            "type": "array",
            "items": {
              "type": "object",
              "properties": {
                "name": { "type": "string" },
                "type": { "type": "string" },
                "required": { "type": "boolean" },
                "description": { "type": "string" }
              }
            }
          },
          "relationships": {
            "type": "array",
            "items": {
              "type": "object",
              "properties": {
                "target_entity": { "type": "string" },
                "relationship_type": { "type": "string" }
              }
            }
          }
        }
      }
    },
    "api_contract_refs": {
      "type": "array",
      "description": "Artifact IDs for API specifications",
      "items": { "type": "string" }
    },
    "infrastructure_spec": {
      "type": "object",
      "required": ["cloud_provider", "services"],
      "properties": {
        "cloud_provider": { "type": "string" },
        "services": {
          "type": "array",
          "items": {
            "type": "object",
            "properties": {
              "name": { "type": "string" },
              "type": { "type": "string" },
              "configuration": { "type": "object" }
            }
          }
        },
        "networking": {
          "type": "object",
          "properties": {
            "vpc_config": { "type": "object" },
            "load_balancing": { "type": "string" }
          }
        },
        "estimated_monthly_cost": {
          "type": "string",
          "description": "Estimated AWS/cloud cost in USD"
        }
      }
    },
    "scalability_notes": {
      "type": "string",
      "description": "Notes on scaling strategy and bottleneck considerations"
    }
  }
}
